t 0 /NodeList/1/$ns3::Ipv4L3Protocol/Tx(1) ns3::Ipv4Header (tos 0x0 DSCP Default ECN Not-ECT ttl 64 id 0 protocol 6 offset (bytes) 0 flags [none] length: 56 10.0.1.1 > 10.0.2.2) ns3::TcpHeader (49153 > 50000 [SYN] Seq=0 Ack=0 Win=65535 ns3::TcpOptionTS(0;0) ns3::TcpOptionWinScale(6) ns3::TcpOptionEnd(EOL))
r 0.0450464 /NodeList/0/$ns3::Ipv4L3Protocol/Rx(1) ns3::Ipv4Header (tos 0x0 DSCP Default ECN Not-ECT ttl 64 id 0 protocol 6 offset (bytes) 0 flags [none] length: 56 10.0.1.1 > 10.0.2.2) ns3::TcpHeader (49153 > 50000 [SYN] Seq=0 Ack=0 Win=65535 ns3::TcpOptionTS(0;0) ns3::TcpOptionWinScale(6) ns3::TcpOptionEnd(EOL))
t 0.0450464 /NodeList/0/$ns3::Ipv4L3Protocol/Tx(2) ns3::Ipv4Header (tos 0x0 DSCP Default ECN Not-ECT ttl 63 id 0 protocol 6 offset (bytes) 0 flags [none] length: 56 10.0.1.1 > 10.0.2.2) ns3::TcpHeader (49153 > 50000 [SYN] Seq=0 Ack=0 Win=65535 ns3::TcpOptionTS(0;0) ns3::TcpOptionWinScale(6) ns3::TcpOptionEnd(EOL))
r 0.0452884 /NodeList/2/$ns3::Ipv4L3Protocol/Rx(1) ns3::Ipv4Header (tos 0x0 DSCP Default ECN Not-ECT ttl 63 id 0 protocol 6 offset (bytes) 0 flags [none] length: 56 10.0.1.1 > 10.0.2.2) ns3::TcpHeader (49153 > 50000 [SYN] Seq=0 Ack=0 Win=65535 ns3::TcpOptionTS(0;0) ns3::TcpOptionWinScale(6) ns3::TcpOptionEnd(EOL))
t 0.0452884 /NodeList/2/$ns3::Ipv4L3Protocol/Tx(1) ns3::Ipv4Header (tos 0x0 DSCP Default ECN Not-ECT ttl 64 id 0 protocol 6 offset (bytes) 0 flags [none] length: 56 10.0.2.2 > 10.0.1.1) ns3::TcpHeader (50000 > 49153 [SYN|ACK] Seq=0 Ack=1 Win=65535 ns3::TcpOptionTS(45;0) ns3::TcpOptionWinScale(6) ns3::TcpOptionEnd(EOL))
r 0.0455304 /NodeList/0/$ns3::Ipv4L3Protocol/Rx(2) ns3::Ipv4Header (tos 0x0 DSCP Default ECN Not-ECT ttl 64 id 0 protocol 6 offset (bytes) 0 flags [none] length: 56 10.0.2.2 > 10.0.1.1) ns3::TcpHeader (50000 > 49153 [SYN|ACK] Seq=0 Ack=1 Win=65535 ns3::TcpOptionTS(45;0) ns3::TcpOptionWinScale(6) ns3::TcpOptionEnd(EOL))
t 0.0455304 /NodeList/0/$ns3::Ipv4L3Protocol/Tx(1) ns3::Ipv4Header (tos 0x0 DSCP Default ECN Not-ECT ttl 63 id 0 protocol 6 offset (bytes) 0 flags [none] length: 56 10.0.2.2 > 10.0.1.1) ns3::TcpHeader (50000 > 49153 [SYN|ACK] Seq=0 Ack=1 Win=65535 ns3::TcpOptionTS(45;0) ns3::TcpOptionWinScale(6) ns3::TcpOptionEnd(EOL))
r 0.0905768 /NodeList/1/$ns3::Ipv4L3Protocol/Rx(1) ns3::Ipv4Header (tos 0x0 DSCP Default ECN Not-ECT ttl 63 id 0 protocol 6 offset (bytes) 0 flags [none] length: 56 10.0.2.2 > 10.0.1.1) ns3::TcpHeader (50000 > 49153 [SYN|ACK] Seq=0 Ack=1 Win=65535 ns3::TcpOptionTS(45;0) ns3::TcpOptionWinScale(6) ns3::TcpOptionEnd(EOL))
t 0.0905768 /NodeList/1/$ns3::Ipv4L3Protocol/Tx(1) ns3::Ipv4Header (tos 0x0 DSCP Default ECN Not-ECT ttl 64 id 1 protocol 6 offset (bytes) 0 flags [none] length: 52 10.0.1.1 > 10.0.2.2) ns3::TcpHeader (49153 > 50000 [ACK] Seq=1 Ack=1 Win=32768 ns3::TcpOptionTS(90;45) ns3::TcpOptionEnd(EOL))
t 0.0905768 /NodeList/1/$ns3::Ipv4L3Protocol/Tx(1) ns3::Ipv4Header (tos 0x0 DSCP Default ECN Not-ECT ttl 64 id 2 protocol 6 offset (bytes) 0 flags [none] length: 1492 10.0.1.1 > 10.0.2.2) ns3::TcpHeader (49153 > 50000 [ACK] Seq=1 Ack=1 Win=32768 ns3::TcpOptionTS(90;45) ns3::TcpOptionEnd(EOL)) Payload (size=1440)
t 0.0905768 /NodeList/1/$ns3::Ipv4L3Protocol/Tx(1) ns3::Ipv4Header (tos 0x0 DSCP Default ECN Not-ECT ttl 64 id 3 protocol 6 offset (bytes) 0 flags [none] length: 1492 10.0.1.1 > 10.0.2.2) ns3::TcpHeader (49153 > 50000 [ACK] Seq=1441 Ack=1 Win=32768 ns3::TcpOptionTS(90;45) ns3::TcpOptionEnd(EOL)) Payload (size=1440)
t 0.0905768 /NodeList/1/$ns3::Ipv4L3Protocol/Tx(1) ns3::Ipv4Header (tos 0x0 DSCP Default ECN Not-ECT ttl 64 id 4 protocol 6 offset (bytes) 0 flags [none] length: 1492 10.0.1.1 > 10.0.2.2) ns3::TcpHeader (49153 > 50000 [ACK] Seq=2881 Ack=1 Win=32768 ns3::TcpOptionTS(90;45) ns3::TcpOptionEnd(EOL)) Payload (size=1440)
t 0.0905768 /NodeList/1/$ns3::Ipv4L3Protocol/Tx(1) ns3::Ipv4Header (tos 0x0 DSCP Default ECN Not-ECT ttl 64 id 5 protocol 6 offset (bytes) 0 flags [none] length: 1492 10.0.1.1 > 10.0.2.2) ns3::TcpHeader (49153 > 50000 [ACK] Seq=4321 Ack=1 Win=32768 ns3::TcpOptionTS(90;45) ns3::TcpOptionEnd(EOL)) Payload (size=1440)
t 0.0905768 /NodeList/1/$ns3::Ipv4L3Protocol/Tx(1) ns3::Ipv4Header (tos 0x0 DSCP Default ECN Not-ECT ttl 64 id 6 protocol 6 offset (bytes) 0 flags [none] length: 1492 10.0.1.1 > 10.0.2.2) ns3::TcpHeader (49153 > 50000 [ACK] Seq=5761 Ack=1 Win=32768 ns3::TcpOptionTS(90;45) ns3::TcpOptionEnd(EOL)) Payload (size=1440)
t 0.0905768 /NodeList/1/$ns3::Ipv4L3Protocol/Tx(1) ns3::Ipv4Header (tos 0x0 DSCP Default ECN Not-ECT ttl 64 id 7 protocol 6 offset (bytes) 0 flags [none] length: 1492 10.0.1.1 > 10.0.2.2) ns3::TcpHeader (49153 > 50000 [ACK] Seq=7201 Ack=1 Win=32768 ns3::TcpOptionTS(90;45) ns3::TcpOptionEnd(EOL)) Payload (size=1440)
t 0.0905768 /NodeList/1/$ns3::Ipv4L3Protocol/Tx(1) ns3::Ipv4Header (tos 0x0 DSCP Default ECN Not-ECT ttl 64 id 8 protocol 6 offset (bytes) 0 flags [none] length: 1492 10.0.1.1 > 10.0.2.2) ns3::TcpHeader (49153 > 50000 [ACK] Seq=8641 Ack=1 Win=32768 ns3::TcpOptionTS(90;45) ns3::TcpOptionEnd(EOL)) Payload (size=1440)
t 0.0905768 /NodeList/1/$ns3::Ipv4L3Protocol/Tx(1) ns3::Ipv4Header (tos 0x0 DSCP Default ECN Not-ECT ttl 64 id 9 protocol 6 offset (bytes) 0 flags [none] length: 1492 10.0.1.1 > 10.0.2.2) ns3::TcpHeader (49153 > 50000 [ACK] Seq=10081 Ack=1 Win=32768 ns3::TcpOptionTS(90;45) ns3::TcpOptionEnd(EOL)) Payload (size=1440)
t 0.0905768 /NodeList/1/$ns3::Ipv4L3Protocol/Tx(1) ns3::Ipv4Header (tos 0x0 DSCP Default ECN Not-ECT ttl 64 id 10 protocol 6 offset (bytes) 0 flags [none] length: 1492 10.0.1.1 > 10.0.2.2) ns3::TcpHeader (49153 > 50000 [ACK] Seq=11521 Ack=1 Win=32768 ns3::TcpOptionTS(90;45) ns3::TcpOptionEnd(EOL)) Payload (size=1440)
t 0.0905768 /NodeList/1/$ns3::Ipv4L3Protocol/Tx(1) ns3::Ipv4Header (tos 0x0 DSCP Default ECN Not-ECT ttl 64 id 11 protocol 6 offset (bytes) 0 flags [none] length: 1492 10.0.1.1 > 10.0.2.2) ns3::TcpHeader (49153 > 50000 [ACK] Seq=12961 Ack=1 Win=32768 ns3::TcpOptionTS(90;45) ns3::TcpOptionEnd(EOL)) Payload (size=1440)
r 0.13562 /NodeList/0/$ns3::Ipv4L3Protocol/Rx(1) ns3::Ipv4Header (tos 0x0 DSCP Default ECN Not-ECT ttl 64 id 1 protocol 6 offset (bytes) 0 flags [none] length: 52 10.0.1.1 > 10.0.2.2) ns3::TcpHeader (49153 > 50000 [ACK] Seq=1 Ack=1 Win=32768 ns3::TcpOptionTS(90;45) ns3::TcpOptionEnd(EOL))
t 0.13562 /NodeList/0/$ns3::Ipv4L3Protocol/Tx(2) ns3::Ipv4Header (tos 0x0 DSCP Default ECN Not-ECT ttl 63 id 1 protocol 6 offset (bytes) 0 flags [none] length: 52 10.0.1.1 > 10.0.2.2) ns3::TcpHeader (49153 > 50000 [ACK] Seq=1 Ack=1 Win=32768 ns3::TcpOptionTS(90;45) ns3::TcpOptionEnd(EOL))
r 0.135846 /NodeList/2/$ns3::Ipv4L3Protocol/Rx(1) ns3::Ipv4Header (tos 0x0 DSCP Default ECN Not-ECT ttl 63 id 1 protocol 6 offset (bytes) 0 flags [none] length: 52 10.0.1.1 > 10.0.2.2) ns3::TcpHeader (49153 > 50000 [ACK] Seq=1 Ack=1 Win=32768 ns3::TcpOptionTS(90;45) ns3::TcpOptionEnd(EOL))
r 0.136815 /NodeList/0/$ns3::Ipv4L3Protocol/Rx(1) ns3::Ipv4Header (tos 0x0 DSCP Default ECN Not-ECT ttl 64 id 2 protocol 6 offset (bytes) 0 flags [none] length: 1492 10.0.1.1 > 10.0.2.2) ns3::TcpHeader (49153 > 50000 [ACK] Seq=1 Ack=1 Win=32768 ns3::TcpOptionTS(90;45) ns3::TcpOptionEnd(EOL)) Payload (size=1440)
t 0.136815 /NodeList/0/$ns3::Ipv4L3Protocol/Tx(2) ns3::Ipv4Header (tos 0x0 DSCP Default ECN Not-ECT ttl 63 id 2 protocol 6 offset (bytes) 0 flags [none] length: 1492 10.0.1.1 > 10.0.2.2) ns3::TcpHeader (49153 > 50000 [ACK] Seq=1 Ack=1 Win=32768 ns3::TcpOptionTS(90;45) ns3::TcpOptionEnd(EOL)) Payload (size=1440)
r 0.13801 /NodeList/0/$ns3::Ipv4L3Protocol/Rx(1) ns3::Ipv4Header (tos 0x0 DSCP Default ECN Not-ECT ttl 64 id 3 protocol 6 offset (bytes) 0 flags [none] length: 1492 10.0.1.1 > 10.0.2.2) ns3::TcpHeader (49153 > 50000 [ACK] Seq=1441 Ack=1 Win=32768 ns3::TcpOptionTS(90;45) ns3::TcpOptionEnd(EOL)) Payload (size=1440)
t 0.13801 /NodeList/0/$ns3::Ipv4L3Protocol/Tx(2) ns3::Ipv4Header (tos 0x0 DSCP Default ECN Not-ECT ttl 63 id 3 protocol 6 offset (bytes) 0 flags [none] length: 1492 10.0.1.1 > 10.0.2.2) ns3::TcpHeader (49153 > 50000 [ACK] Seq=1441 Ack=1 Win=32768 ns3::TcpOptionTS(90;45) ns3::TcpOptionEnd(EOL)) Payload (size=1440)
r 0.139206 /NodeList/0/$ns3::Ipv4L3Protocol/Rx(1) ns3::Ipv4Header (tos 0x0 DSCP Default ECN Not-ECT ttl 64 id 4 protocol 6 offset (bytes) 0 flags [none] length: 1492 10.0.1.1 > 10.0.2.2) ns3::TcpHeader (49153 > 50000 [ACK] Seq=2881 Ack=1 Win=32768 ns3::TcpOptionTS(90;45) ns3::TcpOptionEnd(EOL)) Payload (size=1440)
t 0.139206 /NodeList/0/$ns3::Ipv4L3Protocol/Tx(2) ns3::Ipv4Header (tos 0x0 DSCP Default ECN Not-ECT ttl 63 id 4 protocol 6 offset (bytes) 0 flags [none] length: 1492 10.0.1.1 > 10.0.2.2) ns3::TcpHeader (49153 > 50000 [ACK] Seq=2881 Ack=1 Win=32768 ns3::TcpOptionTS(90;45) ns3::TcpOptionEnd(EOL)) Payload (size=1440)
r 0.140401 /NodeList/0/$ns3::Ipv4L3Protocol/Rx(1) ns3::Ipv4Header (tos 0x0 DSCP Default ECN Not-ECT ttl 64 id 5 protocol 6 offset (bytes) 0 flags [none] length: 1492 10.0.1.1 > 10.0.2.2) ns3::TcpHeader (49153 > 50000 [ACK] Seq=4321 Ack=1 Win=32768 ns3::TcpOptionTS(90;45) ns3::TcpOptionEnd(EOL)) Payload (size=1440)
t 0.140401 /NodeList/0/$ns3::Ipv4L3Protocol/Tx(2) ns3::Ipv4Header (tos 0x0 DSCP Default ECN Not-ECT ttl 63 id 5 protocol 6 offset (bytes) 0 flags [none] length: 1492 10.0.1.1 > 10.0.2.2) ns3::TcpHeader (49153 > 50000 [ACK] Seq=4321 Ack=1 Win=32768 ns3::TcpOptionTS(90;45) ns3::TcpOptionEnd(EOL)) Payload (size=1440)
r 0.141596 /NodeList/0/$ns3::Ipv4L3Protocol/Rx(1) ns3::Ipv4Header (tos 0x0 DSCP Default ECN Not-ECT ttl 64 id 6 protocol 6 offset (bytes) 0 flags [none] length: 1492 10.0.1.1 > 10.0.2.2) ns3::TcpHeader (49153 > 50000 [ACK] Seq=5761 Ack=1 Win=32768 ns3::TcpOptionTS(90;45) ns3::TcpOptionEnd(EOL)) Payload (size=1440)
t 0.141596 /NodeList/0/$ns3::Ipv4L3Protocol/Tx(2) ns3::Ipv4Header (tos 0x0 DSCP Default ECN Not-ECT ttl 63 id 6 protocol 6 offset (bytes) 0 flags [none] length: 1492 10.0.1.1 > 10.0.2.2) ns3::TcpHeader (49153 > 50000 [ACK] Seq=5761 Ack=1 Win=32768 ns3::TcpOptionTS(90;45) ns3::TcpOptionEnd(EOL)) Payload (size=1440)
r 0.142791 /NodeList/0/$ns3::Ipv4L3Protocol/Rx(1) ns3::Ipv4Header (tos 0x0 DSCP Default ECN Not-ECT ttl 64 id 7 protocol 6 offset (bytes) 0 flags [none] length: 1492 10.0.1.1 > 10.0.2.2) ns3::TcpHeader (49153 > 50000 [ACK] Seq=7201 Ack=1 Win=32768 ns3::TcpOptionTS(90;45) ns3::TcpOptionEnd(EOL)) Payload (size=1440)
t 0.142791 /NodeList/0/$ns3::Ipv4L3Protocol/Tx(2) ns3::Ipv4Header (tos 0x0 DSCP Default ECN Not-ECT ttl 63 id 7 protocol 6 offset (bytes) 0 flags [none] length: 1492 10.0.1.1 > 10.0.2.2) ns3::TcpHeader (49153 > 50000 [ACK] Seq=7201 Ack=1 Win=32768 ns3::TcpOptionTS(90;45) ns3::TcpOptionEnd(EOL)) Payload (size=1440)
r 0.142801 /NodeList/2/$ns3::Ipv4L3Protocol/Rx(1) ns3::Ipv4Header (tos 0x0 DSCP Default ECN Not-ECT ttl 63 id 2 protocol 6 offset (bytes) 0 flags [none] length: 1492 10.0.1.1 > 10.0.2.2) ns3::TcpHeader (49153 > 50000 [ACK] Seq=1 Ack=1 Win=32768 ns3::TcpOptionTS(90;45) ns3::TcpOptionEnd(EOL)) Payload (size=1440)
t 0.142801 /NodeList/2/$ns3::Ipv4L3Protocol/Tx(1) ns3::Ipv4Header (tos 0x0 DSCP Default ECN Not-ECT ttl 64 id 1 protocol 6 offset (bytes) 0 flags [none] length: 52 10.0.2.2 > 10.0.1.1) ns3::TcpHeader (50000 > 49153 [ACK] Seq=1 Ack=1441 Win=32768 ns3::TcpOptionTS(142;90) ns3::TcpOptionEnd(EOL))
r 0.143027 /NodeList/0/$ns3::Ipv4L3Protocol/Rx(2) ns3::Ipv4Header (tos 0x0 DSCP Default ECN Not-ECT ttl 64 id 1 protocol 6 offset (bytes) 0 flags [none] length: 52 10.0.2.2 > 10.0.1.1) ns3::TcpHeader (50000 > 49153 [ACK] Seq=1 Ack=1441 Win=32768 ns3::TcpOptionTS(142;90) ns3::TcpOptionEnd(EOL))
t 0.143027 /NodeList/0/$ns3::Ipv4L3Protocol/Tx(1) ns3::Ipv4Header (tos 0x0 DSCP Default ECN Not-ECT ttl 63 id 1 protocol 6 offset (bytes) 0 flags [none] length: 52 10.0.2.2 > 10.0.1.1) ns3::TcpHeader (50000 > 49153 [ACK] Seq=1 Ack=1441 Win=32768 ns3::TcpOptionTS(142;90) ns3::TcpOptionEnd(EOL))
r 0.143986 /NodeList/0/$ns3::Ipv4L3Protocol/Rx(1) ns3::Ipv4Header (tos 0x0 DSCP Default ECN Not-ECT ttl 64 id 8 protocol 6 offset (bytes) 0 flags [none] length: 1492 10.0.1.1 > 10.0.2.2) ns3::TcpHeader (49153 > 50000 [ACK] Seq=8641 Ack=1 Win=32768 ns3::TcpOptionTS(90;45) ns3::TcpOptionEnd(EOL)) Payload (size=1440)
t 0.143986 /NodeList/0/$ns3::Ipv4L3Protocol/Tx(2) ns3::Ipv4Header (tos 0x0 DSCP Default ECN Not-ECT ttl 63 id 8 protocol 6 offset (bytes) 0 flags [none] length: 1492 10.0.1.1 > 10.0.2.2) ns3::TcpHeader (49153 > 50000 [ACK] Seq=8641 Ack=1 Win=32768 ns3::TcpOptionTS(90;45) ns3::TcpOptionEnd(EOL)) Payload (size=1440)
r 0.145182 /NodeList/0/$ns3::Ipv4L3Protocol/Rx(1) ns3::Ipv4Header (tos 0x0 DSCP Default ECN Not-ECT ttl 64 id 9 protocol 6 offset (bytes) 0 flags [none] length: 1492 10.0.1.1 > 10.0.2.2) ns3::TcpHeader (49153 > 50000 [ACK] Seq=10081 Ack=1 Win=32768 ns3::TcpOptionTS(90;45) ns3::TcpOptionEnd(EOL)) Payload (size=1440)
t 0.145182 /NodeList/0/$ns3::Ipv4L3Protocol/Tx(2) ns3::Ipv4Header (tos 0x0 DSCP Default ECN Not-ECT ttl 63 id 9 protocol 6 offset (bytes) 0 flags [none] length: 1492 10.0.1.1 > 10.0.2.2) ns3::TcpHeader (49153 > 50000 [ACK] Seq=10081 Ack=1 Win=32768 ns3::TcpOptionTS(90;45) ns3::TcpOptionEnd(EOL)) Payload (size=1440)
r 0.146377 /NodeList/0/$ns3::Ipv4L3Protocol/Rx(1) ns3::Ipv4Header (tos 0x0 DSCP Default ECN Not-ECT ttl 64 id 10 protocol 6 offset (bytes) 0 flags [none] length: 1492 10.0.1.1 > 10.0.2.2) ns3::TcpHeader (49153 > 50000 [ACK] Seq=11521 Ack=1 Win=32768 ns3::TcpOptionTS(90;45) ns3::TcpOptionEnd(EOL)) Payload (size=1440)
t 0.146377 /NodeList/0/$ns3::Ipv4L3Protocol/Tx(2) ns3::Ipv4Header (tos 0x0 DSCP Default ECN Not-ECT ttl 63 id 10 protocol 6 offset (bytes) 0 flags [none] length: 1492 10.0.1.1 > 10.0.2.2) ns3::TcpHeader (49153 > 50000 [ACK] Seq=11521 Ack=1 Win=32768 ns3::TcpOptionTS(90;45) ns3::TcpOptionEnd(EOL)) Payload (size=1440)
r 0.147572 /NodeList/0/$ns3::Ipv4L3Protocol/Rx(1) ns3::Ipv4Header (tos 0x0 DSCP Default ECN Not-ECT ttl 64 id 11 protocol 6 offset (bytes) 0 flags [none] length: 1492 10.0.1.1 > 10.0.2.2) ns3::TcpHeader (49153 > 50000 [ACK] Seq=12961 Ack=1 Win=32768 ns3::TcpOptionTS(90;45) ns3::TcpOptionEnd(EOL)) Payload (size=1440)
t 0.147572 /NodeList/0/$ns3::Ipv4L3Protocol/Tx(2) ns3::Ipv4Header (tos 0x0 DSCP Default ECN Not-ECT ttl 63 id 11 protocol 6 offset (bytes) 0 flags [none] length: 1492 10.0.1.1 > 10.0.2.2) ns3::TcpHeader (49153 > 50000 [ACK] Seq=12961 Ack=1 Win=32768 ns3::TcpOptionTS(90;45) ns3::TcpOptionEnd(EOL)) Payload (size=1440)
r 0.148777 /NodeList/2/$ns3::Ipv4L3Protocol/Rx(1) ns3::Ipv4Header (tos 0x0 DSCP Default ECN Not-ECT ttl 63 id 3 protocol 6 offset (bytes) 0 flags [none] length: 1492 10.0.1.1 > 10.0.2.2) ns3::TcpHeader (49153 > 50000 [ACK] Seq=1441 Ack=1 Win=32768 ns3::TcpOptionTS(90;45) ns3::TcpOptionEnd(EOL)) Payload (size=1440)
r 0.154753 /NodeList/2/$ns3::Ipv4L3Protocol/Rx(1) ns3::Ipv4Header (tos 0x0 DSCP Default ECN Not-ECT ttl 63 id 4 protocol 6 offset (bytes) 0 flags [none] length: 1492 10.0.1.1 > 10.0.2.2) ns3::TcpHeader (49153 > 50000 [ACK] Seq=2881 Ack=1 Win=32768 ns3::TcpOptionTS(90;45) ns3::TcpOptionEnd(EOL)) Payload (size=1440)
t 0.154753 /NodeList/2/$ns3::Ipv4L3Protocol/Tx(1) ns3::Ipv4Header (tos 0x0 DSCP Default ECN Not-ECT ttl 64 id 2 protocol 6 offset (bytes) 0 flags [none] length: 52 10.0.2.2 > 10.0.1.1) ns3::TcpHeader (50000 > 49153 [ACK] Seq=1 Ack=4321 Win=32768 ns3::TcpOptionTS(154;90) ns3::TcpOptionEnd(EOL))
r 0.154979 /NodeList/0/$ns3::Ipv4L3Protocol/Rx(2) ns3::Ipv4Header (tos 0x0 DSCP Default ECN Not-ECT ttl 64 id 2 protocol 6 offset (bytes) 0 flags [none] length: 52 10.0.2.2 > 10.0.1.1) ns3::TcpHeader (50000 > 49153 [ACK] Seq=1 Ack=4321 Win=32768 ns3::TcpOptionTS(154;90) ns3::TcpOptionEnd(EOL))
t 0.154979 /NodeList/0/$ns3::Ipv4L3Protocol/Tx(1) ns3::Ipv4Header (tos 0x0 DSCP Default ECN Not-ECT ttl 63 id 2 protocol 6 offset (bytes) 0 flags [none] length: 52 10.0.2.2 > 10.0.1.1) ns3::TcpHeader (50000 > 49153 [ACK] Seq=1 Ack=4321 Win=32768 ns3::TcpOptionTS(154;90) ns3::TcpOptionEnd(EOL))
r 0.160729 /NodeList/2/$ns3::Ipv4L3Protocol/Rx(1) ns3::Ipv4Header (tos 0x0 DSCP Default ECN Not-ECT ttl 63 id 5 protocol 6 offset (bytes) 0 flags [none] length: 1492 10.0.1.1 > 10.0.2.2) ns3::TcpHeader (49153 > 50000 [ACK] Seq=4321 Ack=1 Win=32768 ns3::TcpOptionTS(90;45) ns3::TcpOptionEnd(EOL)) Payload (size=1440)
r 0.166705 /NodeList/2/$ns3::Ipv4L3Protocol/Rx(1) ns3::Ipv4Header (tos 0x0 DSCP Default ECN Not-ECT ttl 63 id 6 protocol 6 offset (bytes) 0 flags [none] length: 1492 10.0.1.1 > 10.0.2.2) ns3::TcpHeader (49153 > 50000 [ACK] Seq=5761 Ack=1 Win=32768 ns3::TcpOptionTS(90;45) ns3::TcpOptionEnd(EOL)) Payload (size=1440)
t 0.166705 /NodeList/2/$ns3::Ipv4L3Protocol/Tx(1) ns3::Ipv4Header (tos 0x0 DSCP Default ECN Not-ECT ttl 64 id 3 protocol 6 offset (bytes) 0 flags [none] length: 52 10.0.2.2 > 10.0.1.1) ns3::TcpHeader (50000 > 49153 [ACK] Seq=1 Ack=7201 Win=32768 ns3::TcpOptionTS(166;90) ns3::TcpOptionEnd(EOL))
r 0.166931 /NodeList/0/$ns3::Ipv4L3Protocol/Rx(2) ns3::Ipv4Header (tos 0x0 DSCP Default ECN Not-ECT ttl 64 id 3 protocol 6 offset (bytes) 0 flags [none] length: 52 10.0.2.2 > 10.0.1.1) ns3::TcpHeader (50000 > 49153 [ACK] Seq=1 Ack=7201 Win=32768 ns3::TcpOptionTS(166;90) ns3::TcpOptionEnd(EOL))
t 0.166931 /NodeList/0/$ns3::Ipv4L3Protocol/Tx(1) ns3::Ipv4Header (tos 0x0 DSCP Default ECN Not-ECT ttl 63 id 3 protocol 6 offset (bytes) 0 flags [none] length: 52 10.0.2.2 > 10.0.1.1) ns3::TcpHeader (50000 > 49153 [ACK] Seq=1 Ack=7201 Win=32768 ns3::TcpOptionTS(166;90) ns3::TcpOptionEnd(EOL))
r 0.172681 /NodeList/2/$ns3::Ipv4L3Protocol/Rx(1) ns3::Ipv4Header (tos 0x0 DSCP Default ECN Not-ECT ttl 63 id 7 protocol 6 offset (bytes) 0 flags [none] length: 1492 10.0.1.1 > 10.0.2.2) ns3::TcpHeader (49153 > 50000 [ACK] Seq=7201 Ack=1 Win=32768 ns3::TcpOptionTS(90;45) ns3::TcpOptionEnd(EOL)) Payload (size=1440)
r 0.178657 /NodeList/2/$ns3::Ipv4L3Protocol/Rx(1) ns3::Ipv4Header (tos 0x0 DSCP Default ECN Not-ECT ttl 63 id 8 protocol 6 offset (bytes) 0 flags [none] length: 1492 10.0.1.1 > 10.0.2.2) ns3::TcpHeader (49153 > 50000 [ACK] Seq=8641 Ack=1 Win=32768 ns3::TcpOptionTS(90;45) ns3::TcpOptionEnd(EOL)) Payload (size=1440)
t 0.178657 /NodeList/2/$ns3::Ipv4L3Protocol/Tx(1) ns3::Ipv4Header (tos 0x0 DSCP Default ECN Not-ECT ttl 64 id 4 protocol 6 offset (bytes) 0 flags [none] length: 52 10.0.2.2 > 10.0.1.1) ns3::TcpHeader (50000 > 49153 [ACK] Seq=1 Ack=10081 Win=32768 ns3::TcpOptionTS(178;90) ns3::TcpOptionEnd(EOL))
r 0.178883 /NodeList/0/$ns3::Ipv4L3Protocol/Rx(2) ns3::Ipv4Header (tos 0x0 DSCP Default ECN Not-ECT ttl 64 id 4 protocol 6 offset (bytes) 0 flags [none] length: 52 10.0.2.2 > 10.0.1.1) ns3::TcpHeader (50000 > 49153 [ACK] Seq=1 Ack=10081 Win=32768 ns3::TcpOptionTS(178;90) ns3::TcpOptionEnd(EOL))
t 0.178883 /NodeList/0/$ns3::Ipv4L3Protocol/Tx(1) ns3::Ipv4Header (tos 0x0 DSCP Default ECN Not-ECT ttl 63 id 4 protocol 6 offset (bytes) 0 flags [none] length: 52 10.0.2.2 > 10.0.1.1) ns3::TcpHeader (50000 > 49153 [ACK] Seq=1 Ack=10081 Win=32768 ns3::TcpOptionTS(178;90) ns3::TcpOptionEnd(EOL))
r 0.184633 /NodeList/2/$ns3::Ipv4L3Protocol/Rx(1) ns3::Ipv4Header (tos 0x0 DSCP Default ECN Not-ECT ttl 63 id 9 protocol 6 offset (bytes) 0 flags [none] length: 1492 10.0.1.1 > 10.0.2.2) ns3::TcpHeader (49153 > 50000 [ACK] Seq=10081 Ack=1 Win=32768 ns3::TcpOptionTS(90;45) ns3::TcpOptionEnd(EOL)) Payload (size=1440)
r 0.18807 /NodeList/1/$ns3::Ipv4L3Protocol/Rx(1) ns3::Ipv4Header (tos 0x0 DSCP Default ECN Not-ECT ttl 63 id 1 protocol 6 offset (bytes) 0 flags [none] length: 52 10.0.2.2 > 10.0.1.1) ns3::TcpHeader (50000 > 49153 [ACK] Seq=1 Ack=1441 Win=32768 ns3::TcpOptionTS(142;90) ns3::TcpOptionEnd(EOL))
t 0.18807 /NodeList/1/$ns3::Ipv4L3Protocol/Tx(1) ns3::Ipv4Header (tos 0x0 DSCP Default ECN Not-ECT ttl 64 id 12 protocol 6 offset (bytes) 0 flags [none] length: 1492 10.0.1.1 > 10.0.2.2) ns3::TcpHeader (49153 > 50000 [ACK] Seq=14401 Ack=1 Win=32768 ns3::TcpOptionTS(188;142) ns3::TcpOptionEnd(EOL)) Payload (size=1440)
t 0.18807 /NodeList/1/$ns3::Ipv4L3Protocol/Tx(1) ns3::Ipv4Header (tos 0x0 DSCP Default ECN Not-ECT ttl 64 id 13 protocol 6 offset (bytes) 0 flags [none] length: 1492 10.0.1.1 > 10.0.2.2) ns3::TcpHeader (49153 > 50000 [ACK] Seq=15841 Ack=1 Win=32768 ns3::TcpOptionTS(188;142) ns3::TcpOptionEnd(EOL)) Payload (size=1440)
r 0.190609 /NodeList/2/$ns3::Ipv4L3Protocol/Rx(1) ns3::Ipv4Header (tos 0x0 DSCP Default ECN Not-ECT ttl 63 id 10 protocol 6 offset (bytes) 0 flags [none] length: 1492 10.0.1.1 > 10.0.2.2) ns3::TcpHeader (49153 > 50000 [ACK] Seq=11521 Ack=1 Win=32768 ns3::TcpOptionTS(90;45) ns3::TcpOptionEnd(EOL)) Payload (size=1440)
t 0.190609 /NodeList/2/$ns3::Ipv4L3Protocol/Tx(1) ns3::Ipv4Header (tos 0x0 DSCP Default ECN Not-ECT ttl 64 id 5 protocol 6 offset (bytes) 0 flags [none] length: 52 10.0.2.2 > 10.0.1.1) ns3::TcpHeader (50000 > 49153 [ACK] Seq=1 Ack=12961 Win=32768 ns3::TcpOptionTS(190;90) ns3::TcpOptionEnd(EOL))
r 0.190835 /NodeList/0/$ns3::Ipv4L3Protocol/Rx(2) ns3::Ipv4Header (tos 0x0 DSCP Default ECN Not-ECT ttl 64 id 5 protocol 6 offset (bytes) 0 flags [none] length: 52 10.0.2.2 > 10.0.1.1) ns3::TcpHeader (50000 > 49153 [ACK] Seq=1 Ack=12961 Win=32768 ns3::TcpOptionTS(190;90) ns3::TcpOptionEnd(EOL))
t 0.190835 /NodeList/0/$ns3::Ipv4L3Protocol/Tx(1) ns3::Ipv4Header (tos 0x0 DSCP Default ECN Not-ECT ttl 63 id 5 protocol 6 offset (bytes) 0 flags [none] length: 52 10.0.2.2 > 10.0.1.1) ns3::TcpHeader (50000 > 49153 [ACK] Seq=1 Ack=12961 Win=32768 ns3::TcpOptionTS(190;90) ns3::TcpOptionEnd(EOL))
r 0.196585 /NodeList/2/$ns3::Ipv4L3Protocol/Rx(1) ns3::Ipv4Header (tos 0x0 DSCP Default ECN Not-ECT ttl 63 id 11 protocol 6 offset (bytes) 0 flags [none] length: 1492 10.0.1.1 > 10.0.2.2) ns3::TcpHeader (49153 > 50000 [ACK] Seq=12961 Ack=1 Win=32768 ns3::TcpOptionTS(90;45) ns3::TcpOptionEnd(EOL)) Payload (size=1440)
r 0.200022 /NodeList/1/$ns3::Ipv4L3Protocol/Rx(1) ns3::Ipv4Header (tos 0x0 DSCP Default ECN Not-ECT ttl 63 id 2 protocol 6 offset (bytes) 0 flags [none] length: 52 10.0.2.2 > 10.0.1.1) ns3::TcpHeader (50000 > 49153 [ACK] Seq=1 Ack=4321 Win=32768 ns3::TcpOptionTS(154;90) ns3::TcpOptionEnd(EOL))
t 0.200022 /NodeList/1/$ns3::Ipv4L3Protocol/Tx(1) ns3::Ipv4Header (tos 0x0 DSCP Default ECN Not-ECT ttl 64 id 14 protocol 6 offset (bytes) 0 flags [none] length: 1492 10.0.1.1 > 10.0.2.2) ns3::TcpHeader (49153 > 50000 [ACK] Seq=17281 Ack=1 Win=32768 ns3::TcpOptionTS(200;154) ns3::TcpOptionEnd(EOL)) Payload (size=1440)
t 0.200022 /NodeList/1/$ns3::Ipv4L3Protocol/Tx(1) ns3::Ipv4Header (tos 0x0 DSCP Default ECN Not-ECT ttl 64 id 15 protocol 6 offset (bytes) 0 flags [none] length: 1492 10.0.1.1 > 10.0.2.2) ns3::TcpHeader (49153 > 50000 [ACK] Seq=18721 Ack=1 Win=32768 ns3::TcpOptionTS(200;154) ns3::TcpOptionEnd(EOL)) Payload (size=1440)
t 0.200022 /NodeList/1/$ns3::Ipv4L3Protocol/Tx(1) ns3::Ipv4Header (tos 0x0 DSCP Default ECN Not-ECT ttl 64 id 16 protocol 6 offset (bytes) 0 flags [none] length: 1492 10.0.1.1 > 10.0.2.2) ns3::TcpHeader (49153 > 50000 [ACK] Seq=20161 Ack=1 Win=32768 ns3::TcpOptionTS(200;154) ns3::TcpOptionEnd(EOL)) Payload (size=1440)
r 0.211974 /NodeList/1/$ns3::Ipv4L3Protocol/Rx(1) ns3::Ipv4Header (tos 0x0 DSCP Default ECN Not-ECT ttl 63 id 3 protocol 6 offset (bytes) 0 flags [none] length: 52 10.0.2.2 > 10.0.1.1) ns3::TcpHeader (50000 > 49153 [ACK] Seq=1 Ack=7201 Win=32768 ns3::TcpOptionTS(166;90) ns3::TcpOptionEnd(EOL))
t 0.211974 /NodeList/1/$ns3::Ipv4L3Protocol/Tx(1) ns3::Ipv4Header (tos 0x0 DSCP Default ECN Not-ECT ttl 64 id 17 protocol 6 offset (bytes) 0 flags [none] length: 1492 10.0.1.1 > 10.0.2.2) ns3::TcpHeader (49153 > 50000 [ACK] Seq=21601 Ack=1 Win=32768 ns3::TcpOptionTS(211;166) ns3::TcpOptionEnd(EOL)) Payload (size=1440)
t 0.211974 /NodeList/1/$ns3::Ipv4L3Protocol/Tx(1) ns3::Ipv4Header (tos 0x0 DSCP Default ECN Not-ECT ttl 64 id 18 protocol 6 offset (bytes) 0 flags [none] length: 1492 10.0.1.1 > 10.0.2.2) ns3::TcpHeader (49153 > 50000 [ACK] Seq=23041 Ack=1 Win=32768 ns3::TcpOptionTS(211;166) ns3::TcpOptionEnd(EOL)) Payload (size=1440)
t 0.211974 /NodeList/1/$ns3::Ipv4L3Protocol/Tx(1) ns3::Ipv4Header (tos 0x0 DSCP Default ECN Not-ECT ttl 64 id 19 protocol 6 offset (bytes) 0 flags [none] length: 1492 10.0.1.1 > 10.0.2.2) ns3::TcpHeader (49153 > 50000 [ACK] Seq=24481 Ack=1 Win=32768 ns3::TcpOptionTS(211;166) ns3::TcpOptionEnd(EOL)) Payload (size=1440)
r 0.223926 /NodeList/1/$ns3::Ipv4L3Protocol/Rx(1) ns3::Ipv4Header (tos 0x0 DSCP Default ECN Not-ECT ttl 63 id 4 protocol 6 offset (bytes) 0 flags [none] length: 52 10.0.2.2 > 10.0.1.1) ns3::TcpHeader (50000 > 49153 [ACK] Seq=1 Ack=10081 Win=32768 ns3::TcpOptionTS(178;90) ns3::TcpOptionEnd(EOL))
t 0.223926 /NodeList/1/$ns3::Ipv4L3Protocol/Tx(1) ns3::Ipv4Header (tos 0x0 DSCP Default ECN Not-ECT ttl 64 id 20 protocol 6 offset (bytes) 0 flags [none] length: 1492 10.0.1.1 > 10.0.2.2) ns3::TcpHeader (49153 > 50000 [ACK] Seq=25921 Ack=1 Win=32768 ns3::TcpOptionTS(223;178) ns3::TcpOptionEnd(EOL)) Payload (size=1440)
t 0.223926 /NodeList/1/$ns3::Ipv4L3Protocol/Tx(1) ns3::Ipv4Header (tos 0x0 DSCP Default ECN Not-ECT ttl 64 id 21 protocol 6 offset (bytes) 0 flags [none] length: 1492 10.0.1.1 > 10.0.2.2) ns3::TcpHeader (49153 > 50000 [ACK] Seq=27361 Ack=1 Win=32768 ns3::TcpOptionTS(223;178) ns3::TcpOptionEnd(EOL)) Payload (size=1440)
t 0.223926 /NodeList/1/$ns3::Ipv4L3Protocol/Tx(1) ns3::Ipv4Header (tos 0x0 DSCP Default ECN Not-ECT ttl 64 id 22 protocol 6 offset (bytes) 0 flags [none] length: 1492 10.0.1.1 > 10.0.2.2) ns3::TcpHeader (49153 > 50000 [ACK] Seq=28801 Ack=1 Win=32768 ns3::TcpOptionTS(223;178) ns3::TcpOptionEnd(EOL)) Payload (size=1440)
r 0.234266 /NodeList/0/$ns3::Ipv4L3Protocol/Rx(1) ns3::Ipv4Header (tos 0x0 DSCP Default ECN Not-ECT ttl 64 id 12 protocol 6 offset (bytes) 0 flags [none] length: 1492 10.0.1.1 > 10.0.2.2) ns3::TcpHeader (49153 > 50000 [ACK] Seq=14401 Ack=1 Win=32768 ns3::TcpOptionTS(188;142) ns3::TcpOptionEnd(EOL)) Payload (size=1440)
t 0.234266 /NodeList/0/$ns3::Ipv4L3Protocol/Tx(2) ns3::Ipv4Header (tos 0x0 DSCP Default ECN Not-ECT ttl 63 id 12 protocol 6 offset (bytes) 0 flags [none] length: 1492 10.0.1.1 > 10.0.2.2) ns3::TcpHeader (49153 > 50000 [ACK] Seq=14401 Ack=1 Win=32768 ns3::TcpOptionTS(188;142) ns3::TcpOptionEnd(EOL)) Payload (size=1440)
r 0.235461 /NodeList/0/$ns3::Ipv4L3Protocol/Rx(1) ns3::Ipv4Header (tos 0x0 DSCP Default ECN Not-ECT ttl 64 id 13 protocol 6 offset (bytes) 0 flags [none] length: 1492 10.0.1.1 > 10.0.2.2) ns3::TcpHeader (49153 > 50000 [ACK] Seq=15841 Ack=1 Win=32768 ns3::TcpOptionTS(188;142) ns3::TcpOptionEnd(EOL)) Payload (size=1440)
t 0.235461 /NodeList/0/$ns3::Ipv4L3Protocol/Tx(2) ns3::Ipv4Header (tos 0x0 DSCP Default ECN Not-ECT ttl 63 id 13 protocol 6 offset (bytes) 0 flags [none] length: 1492 10.0.1.1 > 10.0.2.2) ns3::TcpHeader (49153 > 50000 [ACK] Seq=15841 Ack=1 Win=32768 ns3::TcpOptionTS(188;142) ns3::TcpOptionEnd(EOL)) Payload (size=1440)
r 0.235878 /NodeList/1/$ns3::Ipv4L3Protocol/Rx(1) ns3::Ipv4Header (tos 0x0 DSCP Default ECN Not-ECT ttl 63 id 5 protocol 6 offset (bytes) 0 flags [none] length: 52 10.0.2.2 > 10.0.1.1) ns3::TcpHeader (50000 > 49153 [ACK] Seq=1 Ack=12961 Win=32768 ns3::TcpOptionTS(190;90) ns3::TcpOptionEnd(EOL))
t 0.235878 /NodeList/1/$ns3::Ipv4L3Protocol/Tx(1) ns3::Ipv4Header (tos 0x0 DSCP Default ECN Not-ECT ttl 64 id 23 protocol 6 offset (bytes) 0 flags [none] length: 1492 10.0.1.1 > 10.0.2.2) ns3::TcpHeader (49153 > 50000 [ACK] Seq=30241 Ack=1 Win=32768 ns3::TcpOptionTS(235;190) ns3::TcpOptionEnd(EOL)) Payload (size=1440)
t 0.235878 /NodeList/1/$ns3::Ipv4L3Protocol/Tx(1) ns3::Ipv4Header (tos 0x0 DSCP Default ECN Not-ECT ttl 64 id 24 protocol 6 offset (bytes) 0 flags [none] length: 1492 10.0.1.1 > 10.0.2.2) ns3::TcpHeader (49153 > 50000 [ACK] Seq=31681 Ack=1 Win=32768 ns3::TcpOptionTS(235;190) ns3::TcpOptionEnd(EOL)) Payload (size=1440)
t 0.235878 /NodeList/1/$ns3::Ipv4L3Protocol/Tx(1) ns3::Ipv4Header (tos 0x0 DSCP Default ECN Not-ECT ttl 64 id 25 protocol 6 offset (bytes) 0 flags [none] length: 1492 10.0.1.1 > 10.0.2.2) ns3::TcpHeader (49153 > 50000 [ACK] Seq=33121 Ack=1 Win=32768 ns3::TcpOptionTS(235;190) ns3::TcpOptionEnd(EOL)) Payload (size=1440)
r 0.240252 /NodeList/2/$ns3::Ipv4L3Protocol/Rx(1) ns3::Ipv4Header (tos 0x0 DSCP Default ECN Not-ECT ttl 63 id 12 protocol 6 offset (bytes) 0 flags [none] length: 1492 10.0.1.1 > 10.0.2.2) ns3::TcpHeader (49153 > 50000 [ACK] Seq=14401 Ack=1 Win=32768 ns3::TcpOptionTS(188;142) ns3::TcpOptionEnd(EOL)) Payload (size=1440)
t 0.240252 /NodeList/2/$ns3::Ipv4L3Protocol/Tx(1) ns3::Ipv4Header (tos 0x0 DSCP Default ECN Not-ECT ttl 64 id 6 protocol 6 offset (bytes) 0 flags [none] length: 52 10.0.2.2 > 10.0.1.1) ns3::TcpHeader (50000 > 49153 [ACK] Seq=1 Ack=15841 Win=32768 ns3::TcpOptionTS(240;90) ns3::TcpOptionEnd(EOL))
r 0.240478 /NodeList/0/$ns3::Ipv4L3Protocol/Rx(2) ns3::Ipv4Header (tos 0x0 DSCP Default ECN Not-ECT ttl 64 id 6 protocol 6 offset (bytes) 0 flags [none] length: 52 10.0.2.2 > 10.0.1.1) ns3::TcpHeader (50000 > 49153 [ACK] Seq=1 Ack=15841 Win=32768 ns3::TcpOptionTS(240;90) ns3::TcpOptionEnd(EOL))
t 0.240478 /NodeList/0/$ns3::Ipv4L3Protocol/Tx(1) ns3::Ipv4Header (tos 0x0 DSCP Default ECN Not-ECT ttl 63 id 6 protocol 6 offset (bytes) 0 flags [none] length: 52 10.0.2.2 > 10.0.1.1) ns3::TcpHeader (50000 > 49153 [ACK] Seq=1 Ack=15841 Win=32768 ns3::TcpOptionTS(240;90) ns3::TcpOptionEnd(EOL))
r 0.246218 /NodeList/0/$ns3::Ipv4L3Protocol/Rx(1) ns3::Ipv4Header (tos 0x0 DSCP Default ECN Not-ECT ttl 64 id 14 protocol 6 offset (bytes) 0 flags [none] length: 1492 10.0.1.1 > 10.0.2.2) ns3::TcpHeader (49153 > 50000 [ACK] Seq=17281 Ack=1 Win=32768 ns3::TcpOptionTS(200;154) ns3::TcpOptionEnd(EOL)) Payload (size=1440)
t 0.246218 /NodeList/0/$ns3::Ipv4L3Protocol/Tx(2) ns3::Ipv4Header (tos 0x0 DSCP Default ECN Not-ECT ttl 63 id 14 protocol 6 offset (bytes) 0 flags [none] length: 1492 10.0.1.1 > 10.0.2.2) ns3::TcpHeader (49153 > 50000 [ACK] Seq=17281 Ack=1 Win=32768 ns3::TcpOptionTS(200;154) ns3::TcpOptionEnd(EOL)) Payload (size=1440)
r 0.246228 /NodeList/2/$ns3::Ipv4L3Protocol/Rx(1) ns3::Ipv4Header (tos 0x0 DSCP Default ECN Not-ECT ttl 63 id 13 protocol 6 offset (bytes) 0 flags [none] length: 1492 10.0.1.1 > 10.0.2.2) ns3::TcpHeader (49153 > 50000 [ACK] Seq=15841 Ack=1 Win=32768 ns3::TcpOptionTS(188;142) ns3::TcpOptionEnd(EOL)) Payload (size=1440)
r 0.247413 /NodeList/0/$ns3::Ipv4L3Protocol/Rx(1) ns3::Ipv4Header (tos 0x0 DSCP Default ECN Not-ECT ttl 64 id 15 protocol 6 offset (bytes) 0 flags [none] length: 1492 10.0.1.1 > 10.0.2.2) ns3::TcpHeader (49153 > 50000 [ACK] Seq=18721 Ack=1 Win=32768 ns3::TcpOptionTS(200;154) ns3::TcpOptionEnd(EOL)) Payload (size=1440)
t 0.247413 /NodeList/0/$ns3::Ipv4L3Protocol/Tx(2) ns3::Ipv4Header (tos 0x0 DSCP Default ECN Not-ECT ttl 63 id 15 protocol 6 offset (bytes) 0 flags [none] length: 1492 10.0.1.1 > 10.0.2.2) ns3::TcpHeader (49153 > 50000 [ACK] Seq=18721 Ack=1 Win=32768 ns3::TcpOptionTS(200;154) ns3::TcpOptionEnd(EOL)) Payload (size=1440)
r 0.248608 /NodeList/0/$ns3::Ipv4L3Protocol/Rx(1) ns3::Ipv4Header (tos 0x0 DSCP Default ECN Not-ECT ttl 64 id 16 protocol 6 offset (bytes) 0 flags [none] length: 1492 10.0.1.1 > 10.0.2.2) ns3::TcpHeader (49153 > 50000 [ACK] Seq=20161 Ack=1 Win=32768 ns3::TcpOptionTS(200;154) ns3::TcpOptionEnd(EOL)) Payload (size=1440)
t 0.248608 /NodeList/0/$ns3::Ipv4L3Protocol/Tx(2) ns3::Ipv4Header (tos 0x0 DSCP Default ECN Not-ECT ttl 63 id 16 protocol 6 offset (bytes) 0 flags [none] length: 1492 10.0.1.1 > 10.0.2.2) ns3::TcpHeader (49153 > 50000 [ACK] Seq=20161 Ack=1 Win=32768 ns3::TcpOptionTS(200;154) ns3::TcpOptionEnd(EOL)) Payload (size=1440)
r 0.252204 /NodeList/2/$ns3::Ipv4L3Protocol/Rx(1) ns3::Ipv4Header (tos 0x0 DSCP Default ECN Not-ECT ttl 63 id 14 protocol 6 offset (bytes) 0 flags [none] length: 1492 10.0.1.1 > 10.0.2.2) ns3::TcpHeader (49153 > 50000 [ACK] Seq=17281 Ack=1 Win=32768 ns3::TcpOptionTS(200;154) ns3::TcpOptionEnd(EOL)) Payload (size=1440)
t 0.252204 /NodeList/2/$ns3::Ipv4L3Protocol/Tx(1) ns3::Ipv4Header (tos 0x0 DSCP Default ECN Not-ECT ttl 64 id 7 protocol 6 offset (bytes) 0 flags [none] length: 52 10.0.2.2 > 10.0.1.1) ns3::TcpHeader (50000 > 49153 [ACK] Seq=1 Ack=18721 Win=32768 ns3::TcpOptionTS(252;188) ns3::TcpOptionEnd(EOL))
r 0.25243 /NodeList/0/$ns3::Ipv4L3Protocol/Rx(2) ns3::Ipv4Header (tos 0x0 DSCP Default ECN Not-ECT ttl 64 id 7 protocol 6 offset (bytes) 0 flags [none] length: 52 10.0.2.2 > 10.0.1.1) ns3::TcpHeader (50000 > 49153 [ACK] Seq=1 Ack=18721 Win=32768 ns3::TcpOptionTS(252;188) ns3::TcpOptionEnd(EOL))
t 0.25243 /NodeList/0/$ns3::Ipv4L3Protocol/Tx(1) ns3::Ipv4Header (tos 0x0 DSCP Default ECN Not-ECT ttl 63 id 7 protocol 6 offset (bytes) 0 flags [none] length: 52 10.0.2.2 > 10.0.1.1) ns3::TcpHeader (50000 > 49153 [ACK] Seq=1 Ack=18721 Win=32768 ns3::TcpOptionTS(252;188) ns3::TcpOptionEnd(EOL))
r 0.25817 /NodeList/0/$ns3::Ipv4L3Protocol/Rx(1) ns3::Ipv4Header (tos 0x0 DSCP Default ECN Not-ECT ttl 64 id 17 protocol 6 offset (bytes) 0 flags [none] length: 1492 10.0.1.1 > 10.0.2.2) ns3::TcpHeader (49153 > 50000 [ACK] Seq=21601 Ack=1 Win=32768 ns3::TcpOptionTS(211;166) ns3::TcpOptionEnd(EOL)) Payload (size=1440)
t 0.25817 /NodeList/0/$ns3::Ipv4L3Protocol/Tx(2) ns3::Ipv4Header (tos 0x0 DSCP Default ECN Not-ECT ttl 63 id 17 protocol 6 offset (bytes) 0 flags [none] length: 1492 10.0.1.1 > 10.0.2.2) ns3::TcpHeader (49153 > 50000 [ACK] Seq=21601 Ack=1 Win=32768 ns3::TcpOptionTS(211;166) ns3::TcpOptionEnd(EOL)) Payload (size=1440)
r 0.25818 /NodeList/2/$ns3::Ipv4L3Protocol/Rx(1) ns3::Ipv4Header (tos 0x0 DSCP Default ECN Not-ECT ttl 63 id 15 protocol 6 offset (bytes) 0 flags [none] length: 1492 10.0.1.1 > 10.0.2.2) ns3::TcpHeader (49153 > 50000 [ACK] Seq=18721 Ack=1 Win=32768 ns3::TcpOptionTS(200;154) ns3::TcpOptionEnd(EOL)) Payload (size=1440)
r 0.259365 /NodeList/0/$ns3::Ipv4L3Protocol/Rx(1) ns3::Ipv4Header (tos 0x0 DSCP Default ECN Not-ECT ttl 64 id 18 protocol 6 offset (bytes) 0 flags [none] length: 1492 10.0.1.1 > 10.0.2.2) ns3::TcpHeader (49153 > 50000 [ACK] Seq=23041 Ack=1 Win=32768 ns3::TcpOptionTS(211;166) ns3::TcpOptionEnd(EOL)) Payload (size=1440)
t 0.259365 /NodeList/0/$ns3::Ipv4L3Protocol/Tx(2) ns3::Ipv4Header (tos 0x0 DSCP Default ECN Not-ECT ttl 63 id 18 protocol 6 offset (bytes) 0 flags [none] length: 1492 10.0.1.1 > 10.0.2.2) ns3::TcpHeader (49153 > 50000 [ACK] Seq=23041 Ack=1 Win=32768 ns3::TcpOptionTS(211;166) ns3::TcpOptionEnd(EOL)) Payload (size=1440)
r 0.26056 /NodeList/0/$ns3::Ipv4L3Protocol/Rx(1) ns3::Ipv4Header (tos 0x0 DSCP Default ECN Not-ECT ttl 64 id 19 protocol 6 offset (bytes) 0 flags [none] length: 1492 10.0.1.1 > 10.0.2.2) ns3::TcpHeader (49153 > 50000 [ACK] Seq=24481 Ack=1 Win=32768 ns3::TcpOptionTS(211;166) ns3::TcpOptionEnd(EOL)) Payload (size=1440)
t 0.26056 /NodeList/0/$ns3::Ipv4L3Protocol/Tx(2) ns3::Ipv4Header (tos 0x0 DSCP Default ECN Not-ECT ttl 63 id 19 protocol 6 offset (bytes) 0 flags [none] length: 1492 10.0.1.1 > 10.0.2.2) ns3::TcpHeader (49153 > 50000 [ACK] Seq=24481 Ack=1 Win=32768 ns3::TcpOptionTS(211;166) ns3::TcpOptionEnd(EOL)) Payload (size=1440)
r 0.264156 /NodeList/2/$ns3::Ipv4L3Protocol/Rx(1) ns3::Ipv4Header (tos 0x0 DSCP Default ECN Not-ECT ttl 63 id 16 protocol 6 offset (bytes) 0 flags [none] length: 1492 10.0.1.1 > 10.0.2.2) ns3::TcpHeader (49153 > 50000 [ACK] Seq=20161 Ack=1 Win=32768 ns3::TcpOptionTS(200;154) ns3::TcpOptionEnd(EOL)) Payload (size=1440)
t 0.264156 /NodeList/2/$ns3::Ipv4L3Protocol/Tx(1) ns3::Ipv4Header (tos 0x0 DSCP Default ECN Not-ECT ttl 64 id 8 protocol 6 offset (bytes) 0 flags [none] length: 52 10.0.2.2 > 10.0.1.1) ns3::TcpHeader (50000 > 49153 [ACK] Seq=1 Ack=21601 Win=32768 ns3::TcpOptionTS(264;200) ns3::TcpOptionEnd(EOL))
r 0.264382 /NodeList/0/$ns3::Ipv4L3Protocol/Rx(2) ns3::Ipv4Header (tos 0x0 DSCP Default ECN Not-ECT ttl 64 id 8 protocol 6 offset (bytes) 0 flags [none] length: 52 10.0.2.2 > 10.0.1.1) ns3::TcpHeader (50000 > 49153 [ACK] Seq=1 Ack=21601 Win=32768 ns3::TcpOptionTS(264;200) ns3::TcpOptionEnd(EOL))
t 0.264382 /NodeList/0/$ns3::Ipv4L3Protocol/Tx(1) ns3::Ipv4Header (tos 0x0 DSCP Default ECN Not-ECT ttl 63 id 8 protocol 6 offset (bytes) 0 flags [none] length: 52 10.0.2.2 > 10.0.1.1) ns3::TcpHeader (50000 > 49153 [ACK] Seq=1 Ack=21601 Win=32768 ns3::TcpOptionTS(264;200) ns3::TcpOptionEnd(EOL))
r 0.270122 /NodeList/0/$ns3::Ipv4L3Protocol/Rx(1) ns3::Ipv4Header (tos 0x0 DSCP Default ECN Not-ECT ttl 64 id 20 protocol 6 offset (bytes) 0 flags [none] length: 1492 10.0.1.1 > 10.0.2.2) ns3::TcpHeader (49153 > 50000 [ACK] Seq=25921 Ack=1 Win=32768 ns3::TcpOptionTS(223;178) ns3::TcpOptionEnd(EOL)) Payload (size=1440)
t 0.270122 /NodeList/0/$ns3::Ipv4L3Protocol/Tx(2) ns3::Ipv4Header (tos 0x0 DSCP Default ECN Not-ECT ttl 63 id 20 protocol 6 offset (bytes) 0 flags [none] length: 1492 10.0.1.1 > 10.0.2.2) ns3::TcpHeader (49153 > 50000 [ACK] Seq=25921 Ack=1 Win=32768 ns3::TcpOptionTS(223;178) ns3::TcpOptionEnd(EOL)) Payload (size=1440)
r 0.270132 /NodeList/2/$ns3::Ipv4L3Protocol/Rx(1) ns3::Ipv4Header (tos 0x0 DSCP Default ECN Not-ECT ttl 63 id 17 protocol 6 offset (bytes) 0 flags [none] length: 1492 10.0.1.1 > 10.0.2.2) ns3::TcpHeader (49153 > 50000 [ACK] Seq=21601 Ack=1 Win=32768 ns3::TcpOptionTS(211;166) ns3::TcpOptionEnd(EOL)) Payload (size=1440)
r 0.271317 /NodeList/0/$ns3::Ipv4L3Protocol/Rx(1) ns3::Ipv4Header (tos 0x0 DSCP Default ECN Not-ECT ttl 64 id 21 protocol 6 offset (bytes) 0 flags [none] length: 1492 10.0.1.1 > 10.0.2.2) ns3::TcpHeader (49153 > 50000 [ACK] Seq=27361 Ack=1 Win=32768 ns3::TcpOptionTS(223;178) ns3::TcpOptionEnd(EOL)) Payload (size=1440)
t 0.271317 /NodeList/0/$ns3::Ipv4L3Protocol/Tx(2) ns3::Ipv4Header (tos 0x0 DSCP Default ECN Not-ECT ttl 63 id 21 protocol 6 offset (bytes) 0 flags [none] length: 1492 10.0.1.1 > 10.0.2.2) ns3::TcpHeader (49153 > 50000 [ACK] Seq=27361 Ack=1 Win=32768 ns3::TcpOptionTS(223;178) ns3::TcpOptionEnd(EOL)) Payload (size=1440)
r 0.272512 /NodeList/0/$ns3::Ipv4L3Protocol/Rx(1) ns3::Ipv4Header (tos 0x0 DSCP Default ECN Not-ECT ttl 64 id 22 protocol 6 offset (bytes) 0 flags [none] length: 1492 10.0.1.1 > 10.0.2.2) ns3::TcpHeader (49153 > 50000 [ACK] Seq=28801 Ack=1 Win=32768 ns3::TcpOptionTS(223;178) ns3::TcpOptionEnd(EOL)) Payload (size=1440)
t 0.272512 /NodeList/0/$ns3::Ipv4L3Protocol/Tx(2) ns3::Ipv4Header (tos 0x0 DSCP Default ECN Not-ECT ttl 63 id 22 protocol 6 offset (bytes) 0 flags [none] length: 1492 10.0.1.1 > 10.0.2.2) ns3::TcpHeader (49153 > 50000 [ACK] Seq=28801 Ack=1 Win=32768 ns3::TcpOptionTS(223;178) ns3::TcpOptionEnd(EOL)) Payload (size=1440)
r 0.276108 /NodeList/2/$ns3::Ipv4L3Protocol/Rx(1) ns3::Ipv4Header (tos 0x0 DSCP Default ECN Not-ECT ttl 63 id 18 protocol 6 offset (bytes) 0 flags [none] length: 1492 10.0.1.1 > 10.0.2.2) ns3::TcpHeader (49153 > 50000 [ACK] Seq=23041 Ack=1 Win=32768 ns3::TcpOptionTS(211;166) ns3::TcpOptionEnd(EOL)) Payload (size=1440)
t 0.276108 /NodeList/2/$ns3::Ipv4L3Protocol/Tx(1) ns3::Ipv4Header (tos 0x0 DSCP Default ECN Not-ECT ttl 64 id 9 protocol 6 offset (bytes) 0 flags [none] length: 52 10.0.2.2 > 10.0.1.1) ns3::TcpHeader (50000 > 49153 [ACK] Seq=1 Ack=24481 Win=32768 ns3::TcpOptionTS(276;211) ns3::TcpOptionEnd(EOL))
r 0.276334 /NodeList/0/$ns3::Ipv4L3Protocol/Rx(2) ns3::Ipv4Header (tos 0x0 DSCP Default ECN Not-ECT ttl 64 id 9 protocol 6 offset (bytes) 0 flags [none] length: 52 10.0.2.2 > 10.0.1.1) ns3::TcpHeader (50000 > 49153 [ACK] Seq=1 Ack=24481 Win=32768 ns3::TcpOptionTS(276;211) ns3::TcpOptionEnd(EOL))
t 0.276334 /NodeList/0/$ns3::Ipv4L3Protocol/Tx(1) ns3::Ipv4Header (tos 0x0 DSCP Default ECN Not-ECT ttl 63 id 9 protocol 6 offset (bytes) 0 flags [none] length: 52 10.0.2.2 > 10.0.1.1) ns3::TcpHeader (50000 > 49153 [ACK] Seq=1 Ack=24481 Win=32768 ns3::TcpOptionTS(276;211) ns3::TcpOptionEnd(EOL))
r 0.282074 /NodeList/0/$ns3::Ipv4L3Protocol/Rx(1) ns3::Ipv4Header (tos 0x0 DSCP Default ECN Not-ECT ttl 64 id 23 protocol 6 offset (bytes) 0 flags [none] length: 1492 10.0.1.1 > 10.0.2.2) ns3::TcpHeader (49153 > 50000 [ACK] Seq=30241 Ack=1 Win=32768 ns3::TcpOptionTS(235;190) ns3::TcpOptionEnd(EOL)) Payload (size=1440)
